{"acceptance_id":"EARLY-STATE-PAPER-DELIVERY-COMPLETION-001","active_stop_conditions":[],"as_of":"2026-08-21","base_main":"6ba592634d26a2880b4084341c9de8711e1f0d3b","capability_radar_now":"NONE","cloud_bundle_mode":"OWNER_MANAGED_OPTIONAL_EXPORT","cloud_bundle_required_by_harness":false,"cloud_bundle_smoke_required":false,"factory_fit":{"path":"docs/evidence/early_state_paper/a1_delivery_factory_fit_v1.json","sha256":"9284080bdccfae951c832b5b823a853c80a225123d3e3deaa3624aecd2b746ee","verdict":"PASS"},"implementation_bindings":{"catalog/assets/core.yaml":"f8b890866b8916df67b8bc0c42a2976ac71966ae51f1a098d844a7e2b5b09a05","catalog/catalog_manifest.yaml":"e7c1969d2061858f4267524dc07c85a50b3b10c76d7a4ef8241eaec0fbd90557","catalog/generated/asset_edges.json":"3ff8c22712a47aa7d9558c66c1c8ce03e0fc968c65c6c28063db4a0bc553b3c3","catalog/schemas/strategy_version.schema.json":"38cd3d8b5f4bad9add9c3b98934c8a0b9f828788f58ed3a1e271987d3a0d63b1","configs/early_state_to_paper_vertical_slice_v1.yaml":"31f6a801a7f74e56be77c29fc64fb5fb4de773cb0d20fefbeaeac6e62f4b3a88","configs/strategies/STRAT-V-EARLY-LIQ-FLOOR-COMMISSIONING-V1.yaml":"b32a155be731cb138a3ef211308a8cd77ac074880c006835c66be0eb3f75cd59","configs/strategies/STRAT-V-EARLY-NETFLOW-TILT-COMMISSIONING-V1.yaml":"636cc6cba092675f1e2cf9dd763b40d0f02cca4f61da491cb1ff63ccfa06b554","docs/PROJECT_MAP.md":"eded78f379bdae7f49c17fefcebdc870149454ce3c29c6081a7f753d48e3d0e9","docs/evidence/early_state_paper/a1_acceptance_v1.json":"6335b0f3a7fa940d6fea48849ee2f7c2239c66c9e15584cd07af53fc74fccd07","docs/evidence/early_state_paper/a1_runtime_receipt_v1.json":"ba6fec2f44969550206008d388703fbe3de39503cb378b5ec2b3610d7863cfdb","docs/reports/early_state_paper/a1_owner_readout_v1.md":"eaeff5d50a908d5a2a059a048b83fab7572af381eb8393bc909f53fd08f37aba","docs/tasks/EARLY_STATE_TO_PAPER_VERTICAL_SLICE_V1.md":"5a26ba4673d340a95661ae59cf3a9abbd009f61bbd538181e814f52b9fb4f7a8","scripts/run_early_state_hypothesis.py":"135282be8dcd1d14f9d1abf965fafdc02ee81d560afb6a0bbf74cae308885f4f","src/solana_alpha_lab/early_state_hypothesis.py":"7c8b51d7358c487db0e0488829aca774aec45271aa08fdd9aeb142b263266c7a","src/solana_alpha_lab/factory/paper_plane.py":"c66164fc9f6607ddc92d594cd7d8b868b9dc68387bae48b481f3a00b0e5b094e","tests/test_early_state_to_paper_vertical_slice.py":"d74604845ad5aed974589a550f30fb3af220658a4a4a8045bde787c5a0ce6d69"},"non_claims":["NO_ALPHA","NO_NETRETURN","NO_REAL_FILLS","NO_MICRO_LIVE","NO_THRESHOLD_SEARCH","NO_ML","NO_PROVIDER_CALL","NO_FACTORY_CORE_CHANGE","NO_CANONICAL_DONE"],"owner_attention_triggers":{"auth_or_access_recovery":false,"external_material_action":false,"material_owner_decision":false,"unresolved_safety_or_truth_conflict":false,"user_only_activation":false},"schema":"smial.delivery-completion-evidence","schema_version":"1.0","side_effects":{"cash_spend_usd_cents":0,"credential_reads":0,"fallbacks":0,"provider_requests":0,"retries":0,"wallet_signer_transaction_actions":0},"state_change":"EARLY_STATE_NO_DECISION_VALUE_AND_GENERIC_RESEARCH_TO_PAPER_PLANE_PASS","task_id":"EARLY_STATE_TO_PAPER_VERTICAL_SLICE_V1","validation":{"full_gate":"ENFORCED_BY_PROJECT_BOUND_VALIDATION","github_ci":"ENFORCED_LIVE_AT_GUARDED_MERGE","independent_review":{"path":"docs/evidence/early_state_paper/a1_delivery_independent_review_v1.json","sha256":"e6ea197ecaa8895a96515b6de89a3f6dd5f8ab9e055abb624b1fcc563f3941d2","verdict":"PASS"},"project_checks":["PASS_EARLY_STATE_PAPER_TESTS","PASS_CATALOG_VALIDATION","PASS_NAVIGATION_CHECK","PASS_SECRET_SCAN"],"targeted":"PASS_EARLY_STATE_PAPER_TESTS"}}
