{
  "schema": "smial.delivery-completion-evidence",
  "schema_version": "1.0",
  "acceptance_id": "NORMALIZED-TRAJECTORY-PROBE-PREREGISTRATION-COMPLETION-001",
  "as_of": "2026-09-05",
  "task_id": "NORMALIZED_TRAJECTORY_PROBE_PREREGISTRATION_V1",
  "state_change": "NORMALIZED_TRAJECTORY_V1_PREREGISTERED_NOT_EXECUTED",
  "base_main": "a946e866370464d7980212118f8535ae963fdb1c",
  "cloud_bundle_mode": "OWNER_MANAGED_OPTIONAL_EXPORT",
  "cloud_bundle_required_by_harness": false,
  "cloud_bundle_smoke_required": false,
  "capability_radar_now": "NONE",
  "implementation_bindings": {
    "catalog/assets/core.yaml": "d9e68073fe324a7d5262e3c37e74225c5b7b3e406569c0be5ef494a197a34d4f",
    "catalog/assets/lifecycle.yaml": "5c87b96eeb9eeeca83d218392c8bbb08ceead5f487eab018ab9f5137d4a33b89",
    "catalog/catalog_manifest.yaml": "940372a5b81027dfa6ba6efe26059e5a65984c94bc4bef75babe80a2c89bec74",
    "catalog/fixtures/semantic_route_gold_queries_v1.yaml": "1f06f961031233aec12a743efe8082484758a89e5137d04ee2a61a1b1d328512",
    "catalog/generated/asset_edges.json": "ed51a1874a1fc8e8955f768ba98b3262feba1dc22f989ba48b89aa7924519f64",
    "configs/factory_semantic_operability_v1.yaml": "4420d9358f0ad2529b400f4072546714d629dd164aa71034a233e86a3c316085",
    "docs/PROJECT_MAP.md": "1d5fe21b58f0b533bcba1b39719fc46a71f67d746216ce8f0cb10b7fab798038",
    "docs/contracts/normalized_trajectory_representation_probe_v1.md": "c4093d5fbe76dd6e6222434f51ddbc83d2d99322197c1705712950cf241a916c",
    "docs/reports/normalized_trajectory_probe_preregistration/a1_owner_readout_v1.md": "5ba0116af07111b6892a2e61a81ce4865cd89fc5bbba3479715e2109d4ec0c88",
    "docs/tasks/NORMALIZED_TRAJECTORY_PROBE_PREREGISTRATION_V1.md": "22b456e03c84c2e5ecd15339b0559a1e8b1a7b3af343bedb74af7dbad37314ae",
    "tests/test_normalized_trajectory_probe_preregistration_v1.py": "e29aa912f2a9c5e831034b567d6cf531197d613a70b2c21c662bcd30c8c4d6db"
  },
  "active_stop_conditions": [],
  "owner_attention_triggers": {
    "auth_or_access_recovery": false,
    "material_owner_decision": false,
    "user_only_activation": false,
    "external_material_action": false,
    "unresolved_safety_or_truth_conflict": false
  },
  "factory_fit": {
    "path": "docs/evidence/normalized_trajectory_probe_preregistration/a1_delivery_factory_fit_v1.json",
    "sha256": "8e686875c87b7847b96465fcd800a107c88dfa3b4ceb37c0852a3d77c65f740d",
    "verdict": "PASS"
  },
  "validation": {
    "targeted": "PASS_PREREGISTRATION_CONTRACT_AND_DISCOVERABILITY",
    "independent_review": {
      "path": "docs/evidence/normalized_trajectory_probe_preregistration/a1_delivery_independent_review_v1.json",
      "sha256": "3fca4143ac404bdf32ac7440458684a3586baa2c7b12fcf21160bf2ecbc43316",
      "verdict": "PASS"
    },
    "full_gate": "ENFORCED_BY_PROJECT_BOUND_VALIDATION",
    "github_ci": "ENFORCED_LIVE_AT_GUARDED_MERGE",
    "project_checks": [
      "PASS_CATALOG_VALIDATE",
      "PASS_SEMANTIC_GOLD_AND_ROUTE_RESOLVE"
    ]
  },
  "non_claims": [
    "NO_TRAJECTORY_PROJECTION_CODE",
    "NO_HFIC_MUTATION",
    "NO_FORGE_EXPERIMENT",
    "NO_CURRENT_COHORT_SCIENCE",
    "NO_ALPHA",
    "NO_GENERATOR_OR_RANKER"
  ],
  "side_effects": {
    "provider_api_rpc_wss_calls": 0,
    "credentials_read": 0,
    "wallet_signer_transaction": 0,
    "cash_spend_usd_cents": 0,
    "experiment_execution": 0,
    "holdout_touches": 0,
    "generator_code_added": 0,
    "new_db": 0
  }
}
