{
  "schema": "smial.delivery-completion-evidence",
  "schema_version": "1.0",
  "acceptance_id": "FORGE-GROUNDED-DISCOVERY-REPAIR-ACCEPTANCE-001",
  "as_of": "2026-09-27",
  "task_id": "FORGE_GROUNDED_DISCOVERY_REPAIR_V1",
  "state_change": "ORDINARY_GROUNDED_DISCOVERY_ROUTE_BOUND",
  "base_main": "30ee1f561224f91e0557650dc7fecfae5e1603f6",
  "cloud_bundle_mode": "OWNER_MANAGED_OPTIONAL_EXPORT",
  "cloud_bundle_required_by_harness": false,
  "cloud_bundle_smoke_required": false,
  "project_sources_disposition": {
    "kind": "NO_CHANGE"
  },
  "capability_radar_now": "NONE",
  "implementation_bindings": {
    ".agents/skills/hypothesis-forge/SKILL.md": "45591619ab33a211bafd8cd70dbd24e0cb2576eaa414c968dc77ba977e81d246",
    ".agents/skills/independent-hypothesis-critic/SKILL.md": "d2e6afd7120443ed95d50357b2c728c4996c8d1474c21e955819aa3fb81ccbed",
    ".cursor/commands/hypothesis-forge.md": "2427457669f70afbc15bcfb906fecdd1953fca9f87e9514a85c8e1bcd7abfbf4",
    "catalog/assets/core.yaml": "4cdd08684d4608e1de8c8092a5d132d3d38f3c230dc2616b3679e2aa926fa4e9",
    "catalog/schemas/forge_run_receipt_v1.schema.json": "cceaeb26aec06517a08e540abbbf1612e49390da68eb6a7009eb611c0a15d642",
    "catalog/schemas/hfic_next_epistemic_action_v1.schema.json": "a4eb2c10f2ce2a64e0fc3802934ad0c3ec6d7a7e90b1b6a9ab1b29313312bb06",
    "catalog/schemas/hypothesis_critic_input_v1.schema.json": "f4d8169d4a899779dc0b09d3e89ae6eae9514a220008a43992411f3aa16b2fb8",
    "catalog/schemas/hypothesis_forge_draft_v1_2.schema.json": "6be4c58c899e38cf5e968365432e5797a57835c578582a3e9bf2e2511f1a72bc",
    "catalog/schemas/hypothesis_forge_session_receipt_v1.schema.json": "4d011963fbd0cbedaa04e7434d84437d1a491d3b54e6d7bd299f8f30b86cb6b9",
    "catalog/schemas/hypothesis_forge_session_receipt_v1_2.schema.json": "94b87d8e391dd82e82ca92e400eeb2c70fcc2242009db223bd6a144c1f7d35b6",
    "catalog/schemas/hypothesis_forge_session_receipt_v1_3.schema.json": "4d11e8da5225c01330499228103c1a6324bf400db4727ab74a85d0d13ebf35e5",
    "configs/factory_semantic_operability_v1.yaml": "b410db626d3e60906807d29e3b945f9ef3396506c11741f4ba6a745e0972f1c3",
    "configs/hypothesis_forge_independent_critic_v1.yaml": "f84067df32eb355a806b45fa810b3f6f143d4a6bc12ba96d21ac35ea0bc5ee32",
    "docs/evidence/forge_grounded_discovery_repair/a1_state_only_coverage_v1.json": "48de612acec9cd17147c0637fcec97fefba0e5da8cf784edc74cef069804eb4d",
    "docs/evidence/task21/owner_pulse_read_model_acceptance_v1.json": "6b21cdb1f60f546df6a7c2ecf63fc315b6fc78e616188f92050a810a93845f35",
    "docs/operator/HYPOTHESIS_FORGE_AND_INDEPENDENT_CRITIC_OPERATOR_V1.md": "0c9bd801147ab8cb9cd24dbd965f686bd01b2b24141143e8b50e6fa5899f2ed7",
    "docs/reports/forge_grounded_discovery_repair/a1_owner_readout_v1.md": "358c80cb22c74bf6cc760bb8c5643d830f16e8a88804a3f916a04898c3f6cd42",
    "docs/tasks/FORGE_GROUNDED_DISCOVERY_REPAIR_V1.md": "679b373da549a04e09731f4e5b9b8c271d7dbea95d121c70940fbdba1056b32e",
    "scripts/hypothesis_forge.py": "1acb6d652ace18f2310f755bd3e607f0b5d34ab62223b3bd0cf123a03cf9a211",
    "src/solana_alpha_lab/factory/hfic_grounded_discovery.py": "e715ab5b4b3d9c432af2191403f144d1cfc63820e0e5e7f9ebcbda2f59e6f0ab",
    "src/solana_alpha_lab/factory/hfic_grounding.py": "b31d8b9acfaff7bff86805f0b14a757ab2ac6e3604794dc99822c9cb2124cf64",
    "src/solana_alpha_lab/factory/hfic_identity.py": "b11b1ed3093b8c0b52883d7cbf530167f0efe94f34ac08afbc7fdc8dc359c7ac",
    "src/solana_alpha_lab/factory/hfic_representation_ladder.py": "f3112f980a0677fb86a7b1dcd5c026b31ffcbf8071497670d054b7c501f42b01",
    "src/solana_alpha_lab/factory/hfic_session.py": "24475c45e9b94bef3d8c590692d6cf7f19d167b2a20c615097d5db6a3876ffa8",
    "tests/test_forge_representation_ladder_v1.py": "208d906615f4d6a83ec00ead1b554a761f192f4c7148f322ed4b85b8a0de7c38",
    "tests/test_hfic_cli.py": "da85fad8c0dcd73000e57387c05ebdcb54c1d39bc29df5cc531318ab8f9352e7",
    "tests/test_hfic_discovery_prospects_and_next_action.py": "a2bddcd37f67994affda50ea72beb19f3c0ff8f336fd4b0884b6193be2d5270e",
    "tests/test_hfic_forge_context_and_no_worthy.py": "6ad9fb8957a21efe8e47a4ffa629409d462af50ab11e46f081aec7c05d75be73",
    "tests/test_hfic_grounded_discovery_v1.py": "7d60cabd70da84118e9319fca9e8634b270a170bb99a7999965f184fe847bdbe",
    "tests/test_hfic_operational_closure_v1.py": "4521ccfa4d9058a86d8ed4e87939520f42f5f7b6723e4af2246d9e220c4fc21d"
  },
  "active_stop_conditions": [],
  "owner_attention_triggers": {
    "auth_or_access_recovery": false,
    "material_owner_decision": false,
    "user_only_activation": false,
    "external_material_action": false,
    "unresolved_safety_or_truth_conflict": false
  },
  "factory_fit": {
    "path": "docs/evidence/forge_grounded_discovery_repair/a1_delivery_factory_fit_v1.json",
    "sha256": "b95804b0e4c958361d54102070394e682ff1e2efb3a43897bbe91a7b906ec5d6",
    "verdict": "PASS"
  },
  "validation": {
    "targeted": "PASS_GROUNDED_DISCOVERY_AND_LADDER_TESTS",
    "independent_review": {
      "path": "docs/evidence/forge_grounded_discovery_repair/a1_delivery_independent_review_v1.json",
      "sha256": "535f0b9e8471bbff7d0dad4529b297fdd465af73e9acc4d7427aec43b0021195",
      "verdict": "PASS"
    },
    "full_gate": "ENFORCED_BY_PROJECT_BOUND_VALIDATION",
    "github_ci": "ENFORCED_LIVE_AT_GUARDED_MERGE",
    "project_checks": [
      "PASS_DELIVERY_HARNESS_CHECK"
    ]
  },
  "non_claims": [
    "NO_MARKET_PROMPT_A",
    "NO_MARKET_CRITIC",
    "NO_EXPERIMENT",
    "NO_LIVE_RDP_WRITE",
    "NO_AUTO_RELEASE",
    "NO_ALPHA",
    "NO_MERGE"
  ],
  "side_effects": {
    "git_mutation_count": 0,
    "provider_calls": 0,
    "cash_spend": 0
  }
}
