{
  "schema": "smial.delivery-completion-evidence",
  "schema_version": "1.0",
  "acceptance_id": "SMIAL_VERIFICATION_POLICY_PATCH_V1-DELIVERY",
  "as_of": "2026-10-09",
  "task_id": "SMIAL_VERIFICATION_POLICY_PATCH_V1",
  "state_change": "IMPLEMENTED_UNVERIFIED",
  "base_main": "0f89ffd8018c05fbafaf79ef609c7dadf888807f",
  "cloud_bundle_mode": "OWNER_MANAGED_OPTIONAL_EXPORT",
  "cloud_bundle_required_by_harness": false,
  "cloud_bundle_smoke_required": false,
  "project_sources_disposition": {
    "kind": "NO_CHANGE",
    "reason": "Git instruction patch only; cloud exports remain optional owner-managed context."
  },
  "capability_radar_now": "NONE",
  "implementation_bindings": {
    ".agents/skills/delivery-harness/SKILL.md": "6ed3830c9cd09726600f017b4c6953c114c0d4dfc7d766f853b0eb925c4b0932",
    "catalog/assets/core.yaml": "b9ed0c16ac7f0cea645fd028f8eb825b1dbdf0a04d5771eddb42c6215ee796a9",
    "delivery-harness/policies/solana-alpha-lab.md": "3621bb2e2f3a27de8c10b904da14b9397789496ca5866674e15873026e017d89",
    "docs/evidence/control/smial_verification_policy_patch_v1/readout.md": "9e29b75ec2bceab47f4f993b494c1eafafb7e93b00be772f25bba11aa1476f10",
    "docs/tasks/SMIAL_VERIFICATION_POLICY_PATCH_V1.md": "d7422214bfa812661912236273c1f92082ec9b87b106fae86dbf61fc76248b18"
  },
  "active_stop_conditions": [],
  "owner_attention_triggers": {
    "auth_or_access_recovery": false,
    "material_owner_decision": false,
    "user_only_activation": false,
    "external_material_action": false,
    "unresolved_safety_or_truth_conflict": false
  },
  "factory_fit": {
    "path": "docs/evidence/control/smial_verification_policy_patch_v1/factory_fit.json",
    "sha256": "a42c7a8106c6ba0f079df7a57f36243dd49fffc85202fc2e35044b945602f035",
    "verdict": "PASS"
  },
  "validation": {
    "targeted": "PASS_EXISTING_32_TESTS_462_SUBTESTS",
    "independent_review": {
      "path": "docs/evidence/control/smial_verification_policy_patch_v1/independent_review.json",
      "sha256": "f0a0c22c9849f396caab8c265713612b944390df4aa786a371a723dea7cb4f28",
      "verdict": "PASS"
    },
    "full_gate": "ENFORCED_BY_PROJECT_BOUND_VALIDATION",
    "github_ci": "ENFORCED_LIVE_AT_GUARDED_MERGE",
    "project_checks": [
      "PASS_HARNESS_CHECK",
      "PASS_ENTRY_CONTEXT",
      "PASS_TARGETED_AFTER_SOURCE_REHASH",
      "PASS_SOURCE_REHASH_IDEMPOTENCY",
      "PASS_FOUR_SIMULATION_ONLY_APPLICABILITY_CASES",
      "PASS_ISOLATED_CODE_REVIEW",
      "PASS_ISOLATED_GOAL_DOD_REVIEW",
      "PASS_ISOLATED_SEMANTIC_PREMISE_ARCHITECTURE_REVIEW",
      "PASS_SEMANTIC_PACKET_LAUNCH_VALIDATION"
    ]
  },
  "non_claims": [
    "NO_MERGE_AUTHORITY",
    "NO_SCIENTIFIC_OR_LIVE_AUTHORITY",
    "NO_MEASURED_QUALITY_OR_COST_GAIN",
    "SIMULATION_ONLY_NOT_PRODUCT_EXECUTION",
    "THREE_NATURAL_OBSERVATIONS_NOT_STARTED"
  ],
  "side_effects": {
    "provider_calls": 0,
    "deployments": 0,
    "settings_changes": 0,
    "scientific_trials": 0,
    "new_test_files": 0,
    "modified_test_files": 0
  }
}
