{
  "schema": "smial.delivery-completion-evidence",
  "schema_version": "1.0",
  "acceptance_id": "a1_preflight_shadow_pin_drift_v1",
  "as_of": "2026-09-15",
  "task_id": "PREFLIGHT_SHADOW_PIN_DRIFT_V1",
  "state_change": "preflight-push DENYs SEPARATE historical shadow-pin drift and worktree/committed byte divergence before first remote push; implementation_bindings compare committed Git blobs.",
  "cloud_bundle_mode": "OWNER_MANAGED_OPTIONAL_EXPORT",
  "cloud_bundle_required_by_harness": false,
  "cloud_bundle_smoke_required": false,
  "implementation_bindings": {
    ".agents/skills/delivery-harness/SKILL.md": "627f5a8047a655768838ebf0e7a211a00dfc35db05ddf5727f9ea80244c3d4c8",
    "AGENTS.md": "fc8e8c1dfe992b9e508e2885f0ecc75b4e7207a8664c56ec72bd4969b2c4026a",
    "catalog/assets/core.yaml": "bd3785658c69d94af084674547270d7c69c26e2ca344c68f008e8046de21dced",
    "delivery-harness/templates/portable-bundle-manifest.json": "816b8bfddd1787560f927cbc6c38f1708056666b02ec9ed010b127b8e7c92db3",
    "delivery-harness/templates/portable-core/dot-agents/skills/delivery-harness/SKILL.md": "28afb8b0031c19a3602769088139ef11edf60e1c730df6ee1a53ca5a09c36b1d",
    "docs/agent/DELIVERY_HARNESS_PROTOCOL.md": "78893392f4b548c1fb6d98b251cf4beec5b86c252afd43705aeee88f318698d8",
    "docs/evidence/control/delivery_harness_acceptance_v1.json": "be343f5019418fb92863dee723c1b0f671eebb3d46abe7a4595f646c34c0c912",
    "docs/evidence/control/owner_attention_gate_acceptance_v1.json": "5d7769690d6a9ca3f816bea9f97e95ef75983816b2ba2537b1c1f72f9bd82d19",
    "docs/evidence/task21/owner_pulse_read_model_acceptance_v1.json": "72e78fc8d2feae293569dda74d11ab6fdc43e2838c0fb41d0d8d504acd4430fa",
    "docs/evidence/task30/a20r1_provider_route_capability_registry_acceptance_v1.json": "29b3edbe890e9b14da5bb21a060585398d90b87a83db57698df0a1fadc7f2023",
    "docs/tasks/PREFLIGHT_SHADOW_PIN_DRIFT_V1.md": "c296b3e0fffee09c74b5302b1dadd25378d57039ee209bc91d9b3c4aef564329",
    "scripts/delivery_harness.py": "88303e36bfc8e0b4a2b1c9757401962905cef7d691467725ae98280be6a5114c",
    "scripts/owner_attention_gate.py": "e5976193d7bb9ee7adb2063fb38955cf2f0a38bea28539854d571950cb74e1fe",
    "tests/test_delivery_harness_deterministic_finish.py": "0a7737e686b80462d26d6f4e5b0a3591991bfae785af667cc63742eabe082263",
    "tests/test_delivery_harness_merge_guard.py": "7804aba59571d6e717167fa9eded5eb5d3f331484ab5a25b3a0d9b136b2a43ae",
    "tests/test_delivery_harness_risk_routing.py": "353d4e110b4e20e8e3813bc9e76ab08702f0c59c5b3a04d1444d87eb15d2c0a6",
    "tests/test_preflight_shadow_pin_drift.py": "c98b85927053c8273f8f12e545cfd225ac168ec396dc67ad5f00444364c81321"
  },
  "active_stop_conditions": [],
  "owner_attention_triggers": {
    "auth_or_access_recovery": false,
    "material_owner_decision": false,
    "user_only_activation": false,
    "external_material_action": false,
    "unresolved_safety_or_truth_conflict": false
  },
  "factory_fit": {
    "path": "docs/evidence/control/a1_preflight_shadow_pin_drift_factory_fit_v1.json",
    "sha256": "f5aef78dabaa9acd062ee72dacb238e5f8098660a09e972a13b0ce653acb654a",
    "verdict": "PASS"
  },
  "validation": {
    "targeted": "PASS_tests_test_preflight_shadow_pin_drift",
    "independent_review": {
      "path": "docs/evidence/control/a1_preflight_shadow_pin_drift_review_v1.json",
      "sha256": "6cea51d3950dcc388efb2c98c3057db240048b8de3f95c18ad428f321e0a4bb6",
      "verdict": "PASS"
    },
    "full_gate": "ENFORCED_BY_PROJECT_BOUND_VALIDATION",
    "github_ci": "ENFORCED_LIVE_AT_GUARDED_MERGE",
    "project_checks": [
      "PASS_tests_delivery_harness_deterministic_finish",
      "PASS_tests_delivery_harness_merge_guard"
    ]
  },
  "non_claims": [
    "NO_HISTORICAL_EVIDENCE_MIGRATION",
    "NO_TASK_CONTRACT_SCHEMA_EXPANSION",
    "NO_DETERMINISTIC_FINISH_REDESIGN",
    "NO_CI_ARCHITECTURE_CHANGE",
    "NO_NEW_REVIEW_ORCHESTRATOR",
    "NO_OWNER_AUTHORITY_CHANGE",
    "NO_PRODUCT_RUNTIME_CHANGE",
    "NO_PRODUCT_ACCEPTANCE",
    "NO_ALPHA",
    "NO_REAL_MONEY"
  ],
  "side_effects": {
    "repository_commits": true,
    "github_pr": true,
    "github_ci": true,
    "external_provider_calls": false,
    "wallet_or_signer_action": false,
    "deployment": false
  },
  "base_main": "3d828150fef69d22845602b656bc304452c5dc8b"
}
