{
  "acceptance_id": "T41-A1-DELIVERY-COMPLETION-001",
  "active_stop_conditions": [],
  "as_of": "2026-08-16",
  "base_main": "f6cf9b422d7fa8ff03e0a295ad750cb8b02066f3",
  "capability_radar_now": "NONE",
  "cloud_bundle_mode": "OWNER_MANAGED_OPTIONAL_EXPORT",
  "cloud_bundle_required_by_harness": false,
  "cloud_bundle_smoke_required": false,
  "factory_fit": {
    "path": "docs/evidence/task41/a1_delivery_factory_fit_v1.json",
    "sha256": "7b43e21af6185af0844b836d40c6757e1d106d5e05bed50c5a6922fe7b79c4f4",
    "verdict": "PASS"
  },
  "implementation_bindings": {
    ".agents/skills/autonomous-delivery/SKILL.md": "a99747b79c1d2d73a9ffffd6d53506b4df876670e9e087e06208cbf1a6076e97",
    ".agents/skills/delivery-harness/SKILL.md": "20fb89acf4c171c7202b4925b231f5736b767a58fd1acb2256c74ab4a265bfea",
    ".cursor/agents/architecture-critic.md": "2d4fbbe8cfb08f459185182605cafac18cbd46361039df66d1e982012faf9251",
    ".cursor/agents/code-reviewer.md": "f43b1ab32dde3e8d61de79e6951f583aa0881eb6b3ed5bb90586473b2defa23a",
    ".cursor/agents/goal-dod-critic.md": "889d6840da8c8b5e5e8a1d6d6fd3474148e74f73097d87d9c11fabcfc4d6f601",
    ".cursor/agents/refactor-critic.md": "37b754229a9a1832c4001afcb627356f7266711ff65861cc9b14b2094f34ab30",
    ".cursor/commands/delivery-review.md": "4610588b5f725e61735625c7046afa1086dd00c4df82c8f27617c8d3d7481caf",
    ".github/pull_request_template.md": "d6d025436652d44d250571a5772585dcfac6c0662e5df4c88779bdc457634aff",
    "AGENTS.md": "808f38cad4954d49faf933328943ac49625d14d694bb17555f9d2f732b65f142",
    "catalog/assets/core.yaml": "4b379761e617f1b25697dccc6e7c62e0128d0c8d39e262187c4e43bc88d30390",
    "delivery-harness/templates/portable-bundle-manifest.json": "112f2bd814299fb82471821a36b58fefe1112a606aee714daf886c7fe4cd9d20",
    "delivery-harness/templates/portable-core/dot-cursor/commands/delivery-review.md": "152c0a264f9fc0c5d138ef965cbdf51dce9ebdab60d9b3f7e21875a58f6429f4",
    "docs/agent/DELIVERY_HARNESS_PROTOCOL.md": "ad0a43b9c3ad2dc66abc8fa7bf60ddd0571037acc84a9a416d2e259118b3e422",
    "docs/evidence/control/delivery_harness_acceptance_v1.json": "d48a279db24189a68bb94dd4e6391923f1370dbd48deae44b7034976420fefe4",
    "docs/evidence/task30/a20r1_provider_route_capability_registry_acceptance_v1.json": "5dbaffbf7579ecfa851bb4ef527ed31af740952f1d61dd6a27df46e88280775b",
    "docs/tasks/TASK-41-isolated-review-and-raw-noclobber.md": "f6ce9a366191ee8c4bd118618af1609d1ebe171f6077bc7fcab9f6a0b5c0634a",
    "scripts/owner_attention_gate.py": "cb4c65cbebcb0f5cb2c53679f0d62bda53596ce1272325d5b123a1f6b8c5c3ab",
    "src/solana_alpha_lab/storage/exclusive.py": "5cb37fbdec0acb6214777aef7699568f2626a6a7a93e8005a921f939b4eb2dcf",
    "src/solana_alpha_lab/task39_h11_named_mint_gta_clock_capture.py": "8a78a2b16f50c8c928c23452eb6eb55813a9aa97a6623a5b39486bd95b5a0935",
    "tests/test_delivery_harness_adapters.py": "54f3a87a1c96a0a8a33be70b212bb1b6fd003ba5e5eea6e790a01b276b17730b",
    "tests/test_delivery_harness_merge_guard.py": "ec8e1de3eec0ab1125cd4a3bedf4559a23b00d4a699a6b0f061cc6ad715899bf",
    "tests/test_storage_exclusive_write.py": "6b657840675b0cae81cde572beddd79016376ad39828dfbd8a2a188681aabc12",
    "tests/test_task39_rc002_h11_named_mint_gta_clock_capture.py": "7769c088c188d3614dcca6a04e13cce2d5e1e9bd14772ec5d80dc18e21d8dbb3"
  },
  "non_claims": [
    "NO_TASK41_CANONICAL_DONE",
    "NO_CRYPTOGRAPHIC_REVIEWER_IDENTITY",
    "OMITTED_ADMISSION_STILL_GROUNDS_MERGE",
    "NO_LIVE_PIT_OR_EXECUTION_CLAIM",
    "NO_ALPHA_PNL_OR_NETRETURN",
    "NO_RUFF_OR_DOMAIN_EXTRACTION"
  ],
  "owner_attention_triggers": {
    "auth_or_access_recovery": false,
    "external_material_action": false,
    "material_owner_decision": false,
    "unresolved_safety_or_truth_conflict": false,
    "user_only_activation": false
  },
  "project_sources_disposition": {
    "kind": "NO_CHANGE"
  },
  "schema": "smial.delivery-completion-evidence",
  "schema_version": "1.0",
  "side_effects": {
    "cash_spend_usd_cents": 0,
    "credential_reads": 0,
    "fallbacks": 0,
    "provider_requests": 0,
    "retries": 0,
    "wallet_signer_transaction_actions": 0
  },
  "state_change": "MERGE_DENIES_RECORDED_AUTHOR_AS_REVIEWER_AND_H11_RAW_PAGES_NOCLOBBER",
  "task_id": "TASK-41",
  "validation": {
    "full_gate": "ENFORCED_BY_PROJECT_BOUND_VALIDATION",
    "github_ci": "ENFORCED_LIVE_AT_GUARDED_MERGE",
    "independent_review": {
      "path": "docs/evidence/task41/a1_delivery_independent_review_v1.json",
      "sha256": "14aa2c22691d555fc780655b5bc17b477a1692ae1dd502cd036b2bfcfd52632e",
      "verdict": "PASS"
    },
    "project_checks": [
      "PASS_GENERATED_NAVIGATION_SECRET_AND_CATALOG_CHECKS"
    ],
    "targeted": "PASS_EXCLUSIVE_WRITE_AND_FALLBACK_DENY_TESTS"
  }
}
